[
 {
  "id": "LEFTOVER-001",
  "severity": "blocker",
  "section": "REVISION NOTES",
  "quote": "REVISION NOTES (delete before submission)",
  "issue": "Internal revision memo left in the submission file; it exposes internal process details (run stamps, AI 'humanisation' passes) that reviewers must not see and that contradict the AI-declaration wording.",
  "suggestion": "Delete the whole block from the submission manuscript (keep it only in the author's private master copy).",
  "axis_link": "Desk-reject risk: leftover editorial artefacts signal an unpolished submission.",
  "group": "P1-precheck",
  "rule": "LEFTOVER-001"
 },
 {
  "id": "ENB-GA-1",
  "severity": "blocker",
  "section": "KIT",
  "quote": "(absent)",
  "issue": "No graphical abstract artefact exists yet; ENB requires it AT submission (531x1328 px+, readable at 5x13 cm).",
  "suggestion": "Produce one pictorial summary (pipeline: audit -> conformal intervals -> honest ceiling -> retrofit bounds); keep text minimal; no GenAI-primary images.",
  "axis_link": "Mandatory submission item; absence = incomplete submission.",
  "group": "P1-precheck",
  "rule": "ENB-GA-1"
 },
 {
  "id": "ENB-ABS-1",
  "severity": "major",
  "section": "ABSTRACT",
  "quote": "Machine learning is now the default tool for predicting resi",
  "issue": "Abstract is 273 words; ENB caps at 250.",
  "suggestion": "Trim to <=250 words keeping purpose/procedures/findings/conclusions.",
  "axis_link": "Hard journal limit; over-long abstracts are returned by the editorial office.",
  "group": "P1-precheck",
  "rule": "ENB-ABS-1"
 },
 {
  "id": "ENB-HL-1",
  "severity": "major",
  "section": "Highlights",
  "quote": "A leakage-audited, uncertainty-calibrated pipeline for residential",
  "issue": "Non-bullet lines (title/authors) inside the Highlights block; the separate highlights file must contain bullets only.",
  "suggestion": "Keep bullets only in highlights file; title/authors belong to title page.",
  "axis_link": "File-format compliance; stray lines break highlights ingestion.",
  "group": "P1-precheck",
  "rule": "ENB-HL-1"
 },
 {
  "id": "ENB-KW-1",
  "severity": "major",
  "section": "TITLE PAGE",
  "quote": "Residential energy prediction; Building stock modelling; Data leakage audit; Conformal prediction; Uncertainty quantification; Climate-regime generalisation; Retrofit savings; Energy performance gap; RECS",
  "issue": "9 keywords; allowed 1-7.",
  "suggestion": "Drop the least discoverable keywords to <=7 (e.g. merge 'Energy performance gap' into others; 'RECS' is a survey name, not an indexing keyword).",
  "axis_link": "Indexing rule; excess keywords are returned at submission.",
  "group": "P1-precheck",
  "rule": "ENB-KW-1"
 },
 {
  "id": "ENB-TBL-1",
  "severity": "major",
  "section": "RESULTS",
  "quote": "(structural) table numbering [1, 2, 4, 5]",
  "issue": "Table numbering gap: no Table [3] cited/defined.",
  "suggestion": "Renumber tables consecutively (or restore the missing table).",
  "axis_link": "Consecutive numbering is a formatting gate; gaps read as missing content.",
  "group": "P1-precheck",
  "rule": "ENB-TBL-1"
 },
 {
  "id": "ENB-FIG-1",
  "severity": "major",
  "section": "RESULTS",
  "quote": "(structural) figure citations [1, 2, 3, 4, 6]",
  "issue": "Figure numbering gap: Fig. [5] never cited/defined.",
  "suggestion": "Renumber figures consecutively or add the missing figure.",
  "axis_link": "Consecutive numbering is a formatting gate.",
  "group": "P1-precheck",
  "rule": "ENB-FIG-1"
 },
 {
  "id": "ENB-TP-1",
  "severity": "minor",
  "section": "TITLE PAGE",
  "quote": "A leakage-audited, uncertainty-calibrated pipeline for residential energy prediction: national-scale evidence from 18,496 U.S. households with climate-regime generalisation and simulation-validated retrofit bounds",
  "issue": "Title runs 22 words; guide asks concise titles.",
  "suggestion": "Shorten while keeping 'leakage-audited', 'uncertainty-calibrated', 'national-scale' (the axis keywords).",
  "axis_link": "Title is the first scope signal for the desk editor.",
  "group": "P1-precheck",
  "rule": "ENB-TP-1"
 },
 {
  "id": "POL-FUND-1",
  "severity": "minor",
  "section": "DECLARATIONS",
  "quote": "(absent)",
  "issue": "No funding statement; Elsevier recommends the standard no-funding sentence.",
  "suggestion": "Add: 'This research did not receive any specific grant from funding agencies in the public, commercial, or not-for-profit sectors.'",
  "axis_link": "Funding disclosure is part of the submission declaration.",
  "group": "P1-precheck",
  "rule": "POL-FUND-1"
 },
 {
  "id": "SAGER-5b",
  "severity": "minor",
  "section": "DATA / LIMITATIONS",
  "quote": "(absent)",
  "issue": "Sex/gender neither used nor discussed although RECS microdata carry household-reference-person demographics (SAGER applied-sciences items).",
  "suggestion": "Add one sentence in Data or Limitations stating sex/gender was not a predictor and noting the generalisability limitation.",
  "axis_link": "SAGER compliance is checked by editors; a one-sentence fix removes the flag.",
  "group": "P1-precheck",
  "rule": "SAGER-5b"
 },
 {
  "id": "REF-2",
  "severity": "minor",
  "section": "REFERENCES",
  "quote": "NeurIPS, 2025. NeurIPS paper checklist guidelines. https://n",
  "issue": "1 web reference(s) without access date.",
  "suggestion": "Add '(accessed DD Month YYYY)' to each web reference.",
  "axis_link": "Journal reference style requires access dates for web sources.",
  "group": "P1-precheck",
  "rule": "REF-2"
 },
 {
  "id": "REF-1",
  "severity": "minor",
  "section": "INTRODUCTION",
  "quote": "Dong, Lam, Huang and Dobbs, 2021",
  "issue": "Mixed et-al convention: some 3+-author works cited with full author lists, others as 'et al.' — style must be consistent.",
  "suggestion": "Pick one convention (recommended: list up to 2 authors, then et al.) and apply everywhere.",
  "axis_link": "Consistency is the only hard referencing rule at submission.",
  "group": "P1-precheck",
  "rule": "REF-1"
 },
 {
  "id": "DAT-4",
  "severity": "minor",
  "section": "REFERENCES",
  "quote": "National Renewable Energy Laboratory, 2025. ResStock 2025.1:",
  "issue": "Third-party datasets cited without the [dataset] tag / version elements.",
  "suggestion": "Tag dataset references with [dataset] and include version/year/identifier.",
  "axis_link": "Data citation is part of Option C compliance.",
  "group": "P1-precheck",
  "rule": "DAT-4"
 },
 {
  "id": "ENB-LINE-1",
  "severity": "minor",
  "section": "KIT",
  "quote": "(file property)",
  "issue": "Continuous line numbers are a journal-specific requirement for the submitted manuscript file (not visible in this plain-text master).",
  "suggestion": "Enable continuous line numbering in the Word/LaTeX submission file.",
  "axis_link": "Reviewers reference lines; missing numbers slow review and flag formatting.",
  "group": "P1-precheck",
  "rule": "ENB-LINE-1"
 }
]